{
  "$schema": "https://json-schema.org/draft/2020-12/schema",
  "$id": "urn:moya:blind-eval:manifest-schema:v0",
  "title": "Moya calligraphy blind-eval sample manifest (single sample, non-identifying metadata only)",
  "description": "MN-EVAL-02: one JSON object per sample. Only randomized sample id, copybook/task version, media type, consent status and non-identifying media metadata. MUST NOT contain child names, WeChat ids, contact info, openids, AppIDs, tokens or URLs.",
  "type": "object",
  "properties": {
    "sample_id": {
      "type": "string",
      "pattern": "^S[0-9]{2}$",
      "description": "Randomly assigned opaque sample id (S01..S20). Assignment is random and must not encode or correlate with any real-world identity.",
      "maxLength": 3
    },
    "copybook_version": {
      "type": "string",
      "pattern": "^cb-[a-z0-9][a-z0-9.-]*$",
      "maxLength": 40,
      "description": "Copybook (字帖) version identifier, synthetic value only."
    },
    "task_version": {
      "type": "string",
      "pattern": "^t-[a-z0-9][a-z0-9.-]*$",
      "maxLength": 40,
      "description": "Task (作业任务) version identifier, synthetic value only."
    },
    "media_type": {
      "enum": ["video", "image"],
      "description": "Submission media type for arm A input."
    },
    "consent_status": {
      "enum": ["authorized", "revoked"],
      "description": "Guardian consent state for this sample. revoked samples MUST be excluded from the blind eval (see protocol.md exit rules)."
    },
    "consent_scope": {
      "const": "blind_eval_only",
      "description": "Consent scope is strictly the offline blind evaluation; no training, no cross-org reuse."
    },
    "deidentification": {
      "const": "done",
      "description": "Confirms the media and manifest have been de-identified before entering the eval set."
    },
    "submission_month": {
      "type": "string",
      "pattern": "^[0-9]{4}-(0[1-9]|1[0-2])$",
      "description": "Coarse (month-precision) submission period; exact timestamps are intentionally not recorded."
    },
    "media_duration_seconds": {
      "type": "integer",
      "minimum": 5,
      "maximum": 180,
      "description": "Required when media_type=video: total practice video duration in seconds (synthetic value in fixtures)."
    },
    "media_image_count": {
      "type": "integer",
      "minimum": 1,
      "maximum": 3,
      "description": "Required when media_type=image: number of finished-work photos (synthetic value in fixtures)."
    },
    "process_frames_selected": {
      "type": "integer",
      "minimum": 0,
      "maximum": 5,
      "description": "Number of manually pre-selected process frames for arm B input. 0 = arm B uses finished image only; 3-5 = arm B adds process frames."
    }
  },
  "required": [
    "sample_id",
    "copybook_version",
    "task_version",
    "media_type",
    "consent_status",
    "consent_scope",
    "deidentification",
    "submission_month"
  ],
  "additionalProperties": false,
  "allOf": [
    {
      "if": { "properties": { "media_type": { "const": "video" } }, "required": ["media_type"] },
      "then": { "required": ["media_duration_seconds"] }
    },
    {
      "if": { "properties": { "media_type": { "const": "image" } }, "required": ["media_type"] },
      "then": { "required": ["media_image_count"] }
    },
    {
      "if": { "properties": { "consent_status": { "const": "revoked" } }, "required": ["consent_status"] },
      "then": { "$comment": "revoked consent must never enter the eval set", "not": {} }
    }
  ]
}
