{
  "consent_scope": "blind_eval_only",
  "consent_status": "authorized",
  "copybook_version": "cb-hardpen-struct-v2",
  "deidentification": "done",
  "media_duration_seconds": 27,
  "media_type": "video",
  "process_frames_selected": 3,
  "sample_id": "S16",
  "submission_month": "2026-09",
  "task_version": "t-struct-2026w6"
}
