{
  "consent_scope": "blind_eval_only",
  "consent_status": "authorized",
  "copybook_version": "cb-hardpen-adv-v1",
  "deidentification": "done",
  "media_duration_seconds": 120,
  "media_type": "video",
  "process_frames_selected": 4,
  "sample_id": "S09",
  "submission_month": "2026-09",
  "task_version": "t-composition-w4"
}
