{
  "consent_scope": "blind_eval_only",
  "consent_status": "authorized",
  "copybook_version": "cb-hardpen-basic-v2",
  "deidentification": "done",
  "media_image_count": 2,
  "media_type": "image",
  "process_frames_selected": 5,
  "sample_id": "S20",
  "submission_month": "2026-09",
  "task_version": "t-review-2026w7"
}
