{
  "consent_scope": "blind_eval_only",
  "consent_status": "authorized",
  "copybook_version": "cb-hardpen-basic-v1",
  "deidentification": "done",
  "media_duration_seconds": 48,
  "media_type": "video",
  "process_frames_selected": 3,
  "sample_id": "S02",
  "submission_month": "2026-08",
  "task_version": "t-stroke-2026w1"
}
