{
  "consent_scope": "blind_eval_only",
  "consent_status": "authorized",
  "copybook_version": "cb-regular-script-v2",
  "deidentification": "done",
  "media_image_count": 2,
  "media_type": "image",
  "process_frames_selected": 4,
  "sample_id": "S14",
  "submission_month": "2026-09",
  "task_version": "t-copy-2026w5"
}
